{
  "$schema": "https://json-schema.org/draft/2020-12/schema",
  "$id": "urn:local-ai-bench:schema:v3:bundle",
  "title": "InferYard bundle v3",
  "type": "object",
  "properties": {
    "schema_version": {
      "type": "integer",
      "const": 3
    },
    "bundle_id": {
      "type": "string",
      "pattern": "^[A-Za-z0-9][A-Za-z0-9_.:-]{0,127}$"
    },
    "version": {
      "type": "string",
      "minLength": 1
    },
    "language": {
      "type": "string",
      "enum": [
        "zh-CN"
      ]
    },
    "license_note": {
      "type": "string",
      "minLength": 1
    },
    "review_records": {
      "type": "array",
      "items": {
        "type": "object",
        "properties": {
          "reviewer": {
            "type": "string",
            "minLength": 1
          },
          "reviewed_at": {
            "type": "string",
            "minLength": 1
          },
          "content_sha256": {
            "type": "string",
            "pattern": "^[a-f0-9]{64}$"
          },
          "conclusion": {
            "type": "string",
            "enum": [
              "approved",
              "rejected"
            ]
          }
        },
        "required": [
          "reviewer",
          "reviewed_at",
          "content_sha256",
          "conclusion"
        ],
        "additionalProperties": false
      },
      "minItems": 0
    },
    "answer_policy": {
      "type": "object",
      "properties": {
        "instruction_newlines": {
          "type": "string",
          "enum": [
            "crlf_to_lf"
          ]
        },
        "strip_line_edges": {
          "type": "boolean"
        },
        "ignore_empty_lines": {
          "type": "boolean"
        },
        "unicode_normalization": {
          "type": "string",
          "enum": [
            "none"
          ]
        },
        "reasoning": {
          "type": "string",
          "enum": [
            "separate_channel_excluded_content_unchanged"
          ]
        }
      },
      "required": [
        "instruction_newlines",
        "strip_line_edges",
        "ignore_empty_lines",
        "unicode_normalization",
        "reasoning"
      ],
      "additionalProperties": false
    },
    "cases": {
      "type": "array",
      "items": {
        "oneOf": [
          {
            "type": "object",
            "properties": {
              "case_id": {
                "type": "string",
                "pattern": "^[A-Za-z0-9][A-Za-z0-9_.:-]{0,127}$"
              },
              "prompt": {
                "type": "string",
                "minLength": 1
              },
              "reference_answer": {
                "type": "string"
              },
              "category": {
                "type": "string",
                "enum": [
                  "instruction"
                ]
              },
              "rules": {
                "type": "object",
                "properties": {
                  "literal_contains": {
                    "type": "array",
                    "items": {
                      "type": "string",
                      "minLength": 1
                    },
                    "minItems": 0
                  },
                  "literal_forbidden": {
                    "type": "array",
                    "items": {
                      "type": "string",
                      "minLength": 1
                    },
                    "minItems": 0
                  },
                  "nonempty_line_count": {
                    "anyOf": [
                      {
                        "type": "integer",
                        "minimum": 0
                      },
                      {
                        "type": "null"
                      }
                    ]
                  }
                },
                "required": [
                  "literal_contains",
                  "literal_forbidden",
                  "nonempty_line_count"
                ],
                "additionalProperties": false
              }
            },
            "required": [
              "case_id",
              "prompt",
              "reference_answer",
              "category",
              "rules"
            ],
            "additionalProperties": false
          },
          {
            "type": "object",
            "properties": {
              "case_id": {
                "type": "string",
                "pattern": "^[A-Za-z0-9][A-Za-z0-9_.:-]{0,127}$"
              },
              "prompt": {
                "type": "string",
                "minLength": 1
              },
              "reference_answer": {
                "type": "string"
              },
              "category": {
                "type": "string",
                "enum": [
                  "extraction"
                ]
              },
              "rules": {
                "type": "object",
                "properties": {
                  "fields": {
                    "type": "object",
                    "minProperties": 1,
                    "additionalProperties": {
                      "type": "object",
                      "properties": {
                        "type": {
                          "type": "string",
                          "enum": [
                            "string",
                            "integer",
                            "number",
                            "boolean",
                            "null"
                          ]
                        },
                        "value": {
                          "type": [
                            "string",
                            "integer",
                            "number",
                            "boolean",
                            "null"
                          ]
                        }
                      },
                      "required": [
                        "type",
                        "value"
                      ],
                      "additionalProperties": false
                    }
                  },
                  "allow_extra_fields": {
                    "type": "boolean"
                  }
                },
                "required": [
                  "fields",
                  "allow_extra_fields"
                ],
                "additionalProperties": false
              }
            },
            "required": [
              "case_id",
              "prompt",
              "reference_answer",
              "category",
              "rules"
            ],
            "additionalProperties": false
          },
          {
            "type": "object",
            "properties": {
              "case_id": {
                "type": "string",
                "pattern": "^[A-Za-z0-9][A-Za-z0-9_.:-]{0,127}$"
              },
              "prompt": {
                "type": "string",
                "minLength": 1
              },
              "reference_answer": {
                "type": "string"
              },
              "category": {
                "type": "string",
                "enum": [
                  "qa"
                ]
              },
              "rules": {
                "type": "object",
                "properties": {
                  "answers": {
                    "type": "array",
                    "items": {
                      "type": "string",
                      "minLength": 1
                    },
                    "minItems": 1
                  },
                  "normalization": {
                    "type": "string",
                    "enum": [
                      "strip",
                      "nfkc_strip"
                    ]
                  }
                },
                "required": [
                  "answers",
                  "normalization"
                ],
                "additionalProperties": false
              }
            },
            "required": [
              "case_id",
              "prompt",
              "reference_answer",
              "category",
              "rules"
            ],
            "additionalProperties": false
          },
          {
            "type": "object",
            "properties": {
              "case_id": {
                "type": "string",
                "pattern": "^[A-Za-z0-9][A-Za-z0-9_.:-]{0,127}$"
              },
              "prompt": {
                "type": "string",
                "minLength": 1
              },
              "reference_answer": {
                "type": "string"
              },
              "category": {
                "type": "string",
                "enum": [
                  "math"
                ]
              },
              "rules": {
                "type": "object",
                "properties": {
                  "expected": {
                    "type": "number"
                  },
                  "absolute_tolerance": {
                    "type": "number",
                    "minimum": 0
                  },
                  "relative_tolerance": {
                    "type": "number",
                    "minimum": 0
                  },
                  "unit": {
                    "type": "string"
                  }
                },
                "required": [
                  "expected",
                  "absolute_tolerance",
                  "relative_tolerance",
                  "unit"
                ],
                "additionalProperties": false
              }
            },
            "required": [
              "case_id",
              "prompt",
              "reference_answer",
              "category",
              "rules"
            ],
            "additionalProperties": false
          },
          {
            "type": "object",
            "properties": {
              "case_id": {
                "type": "string",
                "pattern": "^[A-Za-z0-9][A-Za-z0-9_.:-]{0,127}$"
              },
              "prompt": {
                "type": "string",
                "minLength": 1
              },
              "reference_answer": {
                "type": "string"
              },
              "category": {
                "type": "string",
                "enum": [
                  "classification"
                ]
              },
              "rules": {
                "type": "object",
                "properties": {
                  "labels": {
                    "type": "array",
                    "items": {
                      "type": "string",
                      "minLength": 1
                    },
                    "minItems": 2
                  },
                  "expected": {
                    "type": "string",
                    "minLength": 1
                  }
                },
                "required": [
                  "labels",
                  "expected"
                ],
                "additionalProperties": false
              }
            },
            "required": [
              "case_id",
              "prompt",
              "reference_answer",
              "category",
              "rules"
            ],
            "additionalProperties": false
          },
          {
            "type": "object",
            "properties": {
              "case_id": {
                "type": "string",
                "pattern": "^[A-Za-z0-9][A-Za-z0-9_.:-]{0,127}$"
              },
              "prompt": {
                "type": "string",
                "minLength": 1
              },
              "reference_answer": {
                "type": "string"
              },
              "category": {
                "type": "string",
                "enum": [
                  "structured"
                ]
              },
              "rules": {
                "type": "object",
                "properties": {
                  "json_schema": {
                    "type": "object"
                  },
                  "expected": {
                    "type": [
                      "object",
                      "array",
                      "string",
                      "number",
                      "boolean",
                      "null"
                    ]
                  },
                  "fields": {
                    "type": "array",
                    "items": {
                      "type": "string"
                    },
                    "minItems": 1
                  },
                  "array_matching": {
                    "type": "string",
                    "enum": [
                      "ordered"
                    ]
                  }
                },
                "required": [
                  "json_schema",
                  "expected",
                  "fields",
                  "array_matching"
                ],
                "additionalProperties": false
              }
            },
            "required": [
              "case_id",
              "prompt",
              "reference_answer",
              "category",
              "rules"
            ],
            "additionalProperties": false
          },
          {
            "type": "object",
            "properties": {
              "case_id": {
                "type": "string",
                "pattern": "^[A-Za-z0-9][A-Za-z0-9_.:-]{0,127}$"
              },
              "prompt": {
                "type": "string",
                "minLength": 1
              },
              "reference_answer": {
                "type": "string"
              },
              "category": {
                "type": "string",
                "enum": [
                  "performance"
                ]
              },
              "rules": {
                "type": "object",
                "properties": {
                  "output_target_tokens": {
                    "anyOf": [
                      {
                        "type": "integer",
                        "minimum": 0
                      },
                      {
                        "type": "null"
                      }
                    ]
                  }
                },
                "required": [
                  "output_target_tokens"
                ],
                "additionalProperties": false
              }
            },
            "required": [
              "case_id",
              "prompt",
              "reference_answer",
              "category",
              "rules"
            ],
            "additionalProperties": false
          },
          {
            "type": "object",
            "properties": {
              "case_id": {
                "type": "string",
                "pattern": "^[A-Za-z0-9][A-Za-z0-9_.:-]{0,127}$"
              },
              "prompt": {
                "type": "string",
                "minLength": 1
              },
              "reference_answer": {
                "type": "string"
              },
              "category": {
                "type": "string",
                "enum": [
                  "svg"
                ]
              },
              "rules": {
                "type": "object",
                "properties": {},
                "required": [],
                "additionalProperties": false
              }
            },
            "required": [
              "case_id",
              "prompt",
              "reference_answer",
              "category",
              "rules"
            ],
            "additionalProperties": false
          }
        ]
      },
      "minItems": 1
    },
    "task_protocol": {
      "type": "string",
      "enum": [
        "quality",
        "performance"
      ]
    },
    "case_review_records": {
      "type": "array",
      "items": {
        "type": "object",
        "properties": {
          "definition": {
            "type": "string",
            "enum": [
              "case-review.v1"
            ]
          },
          "case_id": {
            "type": "string",
            "pattern": "^[A-Za-z0-9][A-Za-z0-9_.:-]{0,127}$"
          },
          "content_sha256": {
            "type": "string",
            "pattern": "^[a-f0-9]{64}$"
          },
          "reviewer": {
            "type": "string",
            "minLength": 1
          },
          "reviewed_at": {
            "type": "string",
            "minLength": 1
          },
          "conclusion": {
            "type": "string",
            "enum": [
              "approved",
              "rejected"
            ]
          }
        },
        "required": [
          "definition",
          "case_id",
          "content_sha256",
          "reviewer",
          "reviewed_at",
          "conclusion"
        ],
        "additionalProperties": false
      },
      "minItems": 0
    },
    "review_provenance": {
      "type": "array",
      "items": {
        "type": "object",
        "properties": {
          "source_json": {
            "type": "string",
            "minLength": 1
          },
          "source_sha256": {
            "type": "string",
            "pattern": "^[a-f0-9]{64}$"
          },
          "source_content_sha256": {
            "type": "string",
            "pattern": "^[a-f0-9]{64}$"
          }
        },
        "required": [
          "source_json",
          "source_sha256",
          "source_content_sha256"
        ],
        "additionalProperties": false
      },
      "minItems": 1
    }
  },
  "required": [
    "schema_version",
    "bundle_id",
    "version",
    "language",
    "license_note",
    "review_records",
    "answer_policy",
    "cases",
    "task_protocol"
  ],
  "additionalProperties": false
}
